{
  "schema_version": 1,
  "id": "tw-new-style-private-passenger-v1",
  "character_classes": {
    "L": "ABCDEFGHJKLMNPQRSTUVWXYZ",
    "D": "012356789"
  },
  "rules": [
    {
      "id": "new-style-private-passenger-lll-dddd",
      "tokens": [
        {"class": "L"},
        {"class": "L"},
        {"class": "L"},
        {"class": "D"},
        {"class": "D"},
        {"class": "D"},
        {"class": "D"}
      ],
      "separator": "-",
      "separator_after": [3],
      "plate_type": "new-style-private-passenger",
      "weight": 1.0,
      "enabled": true
    }
  ]
}
